{
  "request_id": "0xb95585833d21070853fd3a207802ef54fa27fcbe847ae387bb25f15b79dd2d81",
  "client_id": "0xce665c932b8b6adb314bf6ba6b5561b528027ce19de675f4c3136d7f91bf23a8",
  "agent_id": "0x3b012bc1ee917e20bc9fd4e7e96949b845385fe2337c9b7e57ddb78612a22c78",
  "action": "PLACE",
  "ref_id": "0x4253f8c51272c785bd58704a4d22f7205299f6bf601dc39e6e0b8a72c58ca0da",
  "issued_at": 1791663000,
  "expires_at": 1791663060,
  "signature": "0x1b785afb1bfd7246bbfef57fc8d4da571143c97922999a372b464e53a85140b6407e3b4054be6cd7cb07568c02edb9ab461ba6b862fe35991ef9d2bbb9e44f641b"
}
